DC Brushed Motor,6V Brushed DC motor,1,,https://www.amazon.co.uk/Gikfun-1V-6V-Hobby-Arduino-EK1894/dp/B07BHHP2BT,Loose,20,30,20
DC Gearbox Motor,TT Gearbox DC Motor - 200RPM - 3 to 6VDC and wheel,2,,https://www.adafruit.com/product/3777#technical-details,Loose,30,15,15
Motor Mount,Mount for TT Gearbox DC Motors - L-Bracket Type with hardware,2,,https://www.adafruit.com/product/3768,Mounts,15,15,15
*Servo Mount,Mount for servo motor,2,,VK,Mounts,30,15,5
*Servos,FS90R Micro Continuous Rotation Servo w/Wheel,2,,https://www.rapidonline.com/feetech-fs90r-servo-and-wheel-37-1336,Mounts,20,30,10
*M2.5 bolt (6),6 mm long M2.5 bolt,8,,https://www.accu.co.uk/pozi-pan-head-screws/9255-SPP-M2-5-6-A2,Hardware,5,5,6
*M2.5 standoff (12/SS),12 mm long socket-to-socket M2.5 standoff,4,,https://uk.farnell.com/wurth-elektronik/970120151/standoff-hex-female-female-12mm/dp/2884528,Hardware,5,5,12
